七村精装房拎包入住。房东诚意出售,桃浦七村雪松苑,210,http://sh.lianjia.com/ershoufang/sh1127915.html
上门实勘，视野很好，配套完善，错过不再有,远东一村,180,http://sh.lianjia.com/ershoufang/sh4197732.html
紧邻地铁+诚意出售+总价低=值得拥有,城南路367弄,200,http://sh.lianjia.com/ershoufang/sh1121224.html
中山北路1321弄，出行方便，省装修费，高区景观好,中山北路1321弄,200,http://sh.lianjia.com/ershoufang/sh4201581.html
绿地新江桥城（一期），满2年，1室1厅1卫，采光这边独好,绿地新江桥城（一期）,230,http://sh.lianjia.com/ershoufang/sh4198428.html
上门实勘，真实在售，成熟社区，满二年,玉兰二村,245,http://sh.lianjia.com/ershoufang/sh4194886.html
总价低 三轨交通 拎包入住 房东诚心急卖,金杨六街坊,250,http://sh.lianjia.com/ershoufang/sh4199098.html
如您所见，正规成熟小区，视野开阔，生活很便利,曹杨三村,180,http://sh.lianjia.com/ershoufang/sh4213004.html
采光这边独好，新出房源，享受好房，高清实拍,华欣家园,240,http://sh.lianjia.com/ershoufang/sh4219402.html
小户型，正规成熟小区，地铁沿线，采光好,何家宅小区,180,http://sh.lianjia.com/ershoufang/sh4189801.html
七村精装房拎包入住。房东诚意出售,桃浦七村雪松苑,210,http://sh.lianjia.com/ershoufang/sh1127915.html
西南小区，满两年，1室0厅，配套完善,西南小区,220,http://sh.lianjia.com/ershoufang/sh4207244.html
白玉新村，温馨一室，满2年，精装修,白玉新村,230,http://sh.lianjia.com/ershoufang/sh4206049.html
百欣苑，2室1厅，满5唯一减税，空气清新,百欣苑,250,http://sh.lianjia.com/ershoufang/sh4225243.html
装修精美，地铁房，上门实勘，满二年,甘泉苑,245,http://sh.lianjia.com/ershoufang/sh4208584.html
绿地新江桥城（三期），成熟社区，观望后悔莫及，上门实勘,绿地新江桥城（三期）,235,http://sh.lianjia.com/ershoufang/sh4213498.html
稀缺低总价电梯一房+朝南正对小区花园,恒升大厦,230,http://sh.lianjia.com/ershoufang/sh4055837.html
房型正气大方小区位置优质小区环境优美周边配套完善,新凯城钟秀苑,220,http://sh.lianjia.com/ershoufang/sh3883703.html
紧邻地铁+诚意出售+总价低=值得拥有,城南路367弄,200,http://sh.lianjia.com/ershoufang/sh1121224.html
上门实勘，满二减税，配套完善，1室1厅,控江路740弄,190,http://sh.lianjia.com/ershoufang/sh4179846.html
甘泉二村，地铁房，拎包入住，小户型,甘泉二村,158,http://sh.lianjia.com/ershoufang/sh4197714.html
广中路310弄，地铁房，高清实拍，视野很好,广中路310弄,185,http://sh.lianjia.com/ershoufang/sh4207561.html
链家好房，火爆热销，省装修费，稀缺南北通,城北新村,150,http://sh.lianjia.com/ershoufang/sh4194302.html
广虹公寓，满二年，品质装修，看房看疯了,广虹公寓,185,http://sh.lianjia.com/ershoufang/sh4168403.html
上下楼方便，好房好心情，上门实勘，温馨一室,远东小区,160,http://sh.lianjia.com/ershoufang/sh3752623.html
毛坯房，满2年，真实在售，配套完善,欣佳宝邸,240,http://sh.lianjia.com/ershoufang/sh4185183.html
房本满两年，好房好心情，景观房，热销好房,绿川小区,230,http://sh.lianjia.com/ershoufang/sh4200042.html
精装修两房，业主诚意出售,江桥二村,235,http://sh.lianjia.com/ershoufang/sh4188493.html
人乐三村，精致户型，成熟社区，交通方便,人乐三村,170,http://sh.lianjia.com/ershoufang/sh4224166.html
密三小区，配套完善，上下楼方便，高清实拍,密三小区,235,http://sh.lianjia.com/ershoufang/sh4220688.html
拎包入住，视野开阔，随时可看，成熟社区,龙湖蔚澜香醍,163,http://sh.lianjia.com/ershoufang/sh4193916.html
稀缺一楼带天井 精装全明户型 中心位置 钥匙房,莲花新村,230,http://sh.lianjia.com/ershoufang/sh4193221.html
金硕河畔景园，马上看房，温馨之家，满2年,金硕河畔景园,215,http://sh.lianjia.com/ershoufang/sh4093432.html
华亭新家百合苑，没装修过，高清实拍，火热出售,华亭新家百合苑,220,http://sh.lianjia.com/ershoufang/sh4228843.html
紧邻地铁十号线，华润万象城附近，近吴中路,龙柏三村,238,http://sh.lianjia.com/ershoufang/sh4157299.html
视野开阔，上门实勘，一链倾城，2室1厅1卫,幸福公寓,215,http://sh.lianjia.com/ershoufang/sh4190192.html
新一小区，上门实拍，错过不再有，交通方便,新一小区,200,http://sh.lianjia.com/ershoufang/sh4213480.html
随时可看，链家房源，人气房源，上门实勘,龙华路2373弄,220,http://sh.lianjia.com/ershoufang/sh3875734.html
真北一街坊，高区景观房，来电即看，地铁房,真北一街坊,240,http://sh.lianjia.com/ershoufang/sh4203403.html
文苑小区+绿化率高+诚心出售,文苑小区（虹口）,250,http://sh.lianjia.com/ershoufang/sh4182762.html
航华二村，2室1厅1卫，配套完善，闹中取静,航华二村,250,http://sh.lianjia.com/ershoufang/sh4224415.html
紧邻地铁，业主新委托，装修精致，好房好心情,延铁小区,215,http://sh.lianjia.com/ershoufang/sh4222238.html
3房出售，一链倾城，上门实拍，抢鲜笋盘,十字街大楼,250,http://sh.lianjia.com/ershoufang/sh4219550.html
殷行路305弄，配套完善，适合自住，满五年唯一,殷行路305弄,230,http://sh.lianjia.com/ershoufang/sh4220722.html
玉兰一村，满5唯一减税，新鲜挂牌，上门实勘,玉兰一村,205,http://sh.lianjia.com/ershoufang/sh4221913.html
凤城二村，新鲜好房，成熟社区，一链倾城,凤城二村,168,http://sh.lianjia.com/ershoufang/sh4220961.html
紧邻地铁，业主新委托，装修精致，好房好心情,延铁小区,215,http://sh.lianjia.com/ershoufang/sh4222238.html
上门实勘，新鲜好房，放心好房，精装修,金台三居,230,http://sh.lianjia.com/ershoufang/sh4223809.html
装修精致，上门实拍，黄金楼层，真实在售,临沂六村,245,http://sh.lianjia.com/ershoufang/sh4225514.html
玉田新村，空气清新，抢鲜笋盘，正规成熟小区,玉田新村,200,http://sh.lianjia.com/ershoufang/sh4219131.html
航华二村，2室1厅1卫，配套完善，闹中取静,航华二村,250,http://sh.lianjia.com/ershoufang/sh4224415.html
配套完善，高区景观房，错过不再有，上门实拍,真如西村,225,http://sh.lianjia.com/ershoufang/sh4221304.html
一室小户型，生活很便利，新出好房，高清实拍,章家巷小区,235,http://sh.lianjia.com/ershoufang/sh4223578.html
3房出售，一链倾城，上门实拍，抢鲜笋盘,十字街大楼,250,http://sh.lianjia.com/ershoufang/sh4219550.html
繁华地段，成熟小区，交通便利，闹中取静，环境优美,乐山六七村,240,http://sh.lianjia.com/ershoufang/sh1133481.html
泰山三村，正规成熟小区，业主诚意出售，高清实拍,泰山三村,250,http://sh.lianjia.com/ershoufang/sh4165016.html
业主新房买好  满五唯一 全明房,好旺花苑,235,http://sh.lianjia.com/ershoufang/sh4180647.html
赤峰小区，满五年，主卧朝南带天井，诚心出售,赤峰小区,248,http://sh.lianjia.com/ershoufang/sh4180848.html
宛南六村，降价房源，交通便利，满5唯一减税,宛南六村,220,http://sh.lianjia.com/ershoufang/sh4211629.html
装修精美，链家好房，满五省税费，业主信赖,黄陵小区,235,http://sh.lianjia.com/ershoufang/sh4180615.html
出门100米地铁站，小区幽静无遮挡，满五税费低,中二小区,180,http://sh.lianjia.com/ershoufang/sh4190760.html
上门实拍，婚房装修，周边配套成熟，交通方便,共康四村,234,http://sh.lianjia.com/ershoufang/sh1940792.html
大上海国际花园酒店公寓，有爱有家，低区出入方便，高清实拍,大上海国际花园酒店公寓,190,http://sh.lianjia.com/ershoufang/sh4074338.html
稀罕南北通，满五年少税，简约二室，一链倾城,民悦苑,240,http://sh.lianjia.com/ershoufang/sh4157760.html
共富四村，上门实勘，诚意出售，小户型,共富四村,245,http://sh.lianjia.com/ershoufang/sh4210549.html
大上海国际花园酒店公寓，有爱有家，低区出入方便，高清实拍,大上海国际花园酒店公寓,190,http://sh.lianjia.com/ershoufang/sh4074338.html
交通便利+周边生活配套齐全+精装修+业主诚心出售,双辽新村,200,http://sh.lianjia.com/ershoufang/sh4209458.html
打虎山路6弄 一房一厅，诚意出售。,打虎山路6弄,200,http://sh.lianjia.com/ershoufang/sh4168458.html
新德公寓（浦东），精致户型，有爱有家，景观房,新德公寓（浦东）,245,http://sh.lianjia.com/ershoufang/sh4200783.html
黄金楼层，看房方便，交通便利，成熟社区,斜土新村,178,http://sh.lianjia.com/ershoufang/sh1159288.html
满五年唯一，业主刚降价，高清实拍，吉宅出售,日晖六村,203,http://sh.lianjia.com/ershoufang/sh4179720.html
上门实勘，随到随看，吉宅出售，人气房源,宜川五村,200,http://sh.lianjia.com/ershoufang/sh3285425.html
业主诚意抛售96年的一房，房型正气，采光一流,清池路102号,240,http://sh.lianjia.com/ershoufang/sh3881836.html
房东诚意出售，看房提前预约。,恒升半岛,170,http://sh.lianjia.com/ershoufang/sh4150063.html
地铁沿线，采光无敌好，马上看房，上门实拍,欣怡小区,250,http://sh.lianjia.com/ershoufang/sh4181818.html
观望后悔莫及，1室0厅，成熟社区，无装修,闻喜路251弄,180,http://sh.lianjia.com/ershoufang/sh4183732.html
镇宁路465弄，钥匙在手，上门实拍，1室0厅,镇宁路465弄,230,http://sh.lianjia.com/ershoufang/sh4196289.html
有钥匙立即看，1室1厅，低楼层，配套完善,东五小区（浦东）,215,http://sh.lianjia.com/ershoufang/sh1125417.html
看房有钥匙，空气清新，出行方便，成熟社区,延吉东路130弄,200,http://sh.lianjia.com/ershoufang/sh1128499.html
视野开阔，如您所见，地铁直达，马上看房,临汾路541号,188,http://sh.lianjia.com/ershoufang/sh4172913.html
童家浜小区 全南户型 采光全天无遮挡 随时看房,童家浜小区,240,http://sh.lianjia.com/ershoufang/sh4153837.html
真如副中心 地铁房 黄金楼层 采光好 配套齐全,车站新村（普陀）,200,http://sh.lianjia.com/ershoufang/sh4192892.html
上钢八九村，实地看房，交通便利，温馨之家,上钢八九村,215,http://sh.lianjia.com/ershoufang/sh2952617.html
上钢八九村，实地看房，交通便利，温馨之家,上钢八九村,215,http://sh.lianjia.com/ershoufang/sh2952617.html
紧邻地铁，两室户，放心好房，有钥匙立即看,宝钢九村,205,http://sh.lianjia.com/ershoufang/sh3877010.html
真如副中心 地铁房 黄金楼层 采光好 配套齐全,车站新村（普陀）,200,http://sh.lianjia.com/ershoufang/sh4192892.html
上坤公园天地（商住），精装修，景观房，3室2厅,上坤公园天地（商住）,200,http://sh.lianjia.com/ershoufang/sh4191005.html
热门房源，上门实勘，精致户型，观望后悔莫及,金桥新村一街坊,245,http://sh.lianjia.com/ershoufang/sh4150623.html
经典一室户 比邻上财复旦 满五边税费少,武川路245弄,215,http://sh.lianjia.com/ershoufang/sh3010222.html
老装修  南北套西三墙全明  单纯出售,市光三村,210,http://sh.lianjia.com/ershoufang/sh3898733.html
上南八村，链家房源，成熟社区，满两年,上南八村,250,http://sh.lianjia.com/ershoufang/sh4224609.html
人乐四村，新鲜挂牌，低区出入方便，一链倾城,人乐四村,155,http://sh.lianjia.com/ershoufang/sh4222341.html
南北直通，好楼层，人气房源，业主新委托,鹤沙航城东茗苑,240,http://sh.lianjia.com/ershoufang/sh4228846.html
毗邻地铁，适合自住，业主新委托，上门实拍,红旗四街坊,190,http://sh.lianjia.com/ershoufang/sh4216879.html
好房好心情，高清实拍，成熟社区，1室0厅1卫,鞍山四村第三小区,185,http://sh.lianjia.com/ershoufang/sh4210617.html
1室0厅1卫，高区阳光房，房本满两年，高清实拍,永和二村,170,http://sh.lianjia.com/ershoufang/sh4222525.html
地铁口小区 一梯两户 总价低 交通方便,南杨小区（长清路）,200,http://sh.lianjia.com/ershoufang/sh4218719.html
地铁直达，上门实勘，抢鲜笋盘，温馨之家,逸仙二村,215,http://sh.lianjia.com/ershoufang/sh4219897.html
2室1厅，高清实拍，链家好房，成熟社区,江桥一村,198,http://sh.lianjia.com/ershoufang/sh4197446.html
改善住房，热门房源，上门实拍，高区景观好,下沙新街82弄,230,http://sh.lianjia.com/ershoufang/sh4195626.html
川北小区，上门实拍，光线充足，省装修费,川北小区,178,http://sh.lianjia.com/ershoufang/sh4156048.html
《亲和源 大一房 成熟配套 50年产权养老公寓》,亲和源,150,http://sh.lianjia.com/ershoufang/sh1158870.html
云帆佳苑，采光无遮挡，上门实勘，吉宅出售,云帆佳苑,200,http://sh.lianjia.com/ershoufang/sh3676728.html
德华四村，黄金楼层，实地看房，一链倾城,德华四村,212,http://sh.lianjia.com/ershoufang/sh4126324.html
小区环境优雅.黄金楼层.得房率高,金硕河畔景园,250,http://sh.lianjia.com/ershoufang/sh4168673.html
适合自住，配套完善，好楼层，好房好心情,育秀西区,170,http://sh.lianjia.com/ershoufang/sh4170537.html
金桥商务公寓，上门实拍，配套完善，如您所见,金桥商务公寓,150,http://sh.lianjia.com/ershoufang/sh1085863.html
无装修，温馨一室，高清实拍，如您所见,新高苑,230,http://sh.lianjia.com/ershoufang/sh4150075.html
吉宅出售，2室1厅1卫，热门带看，上门实拍,真建一小区,236,http://sh.lianjia.com/ershoufang/sh4131814.html
环庆新苑1房诚心出售，看房方便,环庆新苑,160,http://sh.lianjia.com/ershoufang/sh4214852.html
小区中心位置，黄金楼层，全明户型，,黎安一村,190,http://sh.lianjia.com/ershoufang/sh4182482.html
简约二室，满5税费少，高区景观房，热门带看,南苑一村,200,http://sh.lianjia.com/ershoufang/sh4203596.html
李园二村，上门实拍，高区阳光房，实地看房,李园二村,165,http://sh.lianjia.com/ershoufang/sh4189402.html
华二小区二房双南户型，看房方便,华二小区,230,http://sh.lianjia.com/ershoufang/sh4200215.html
一房两厅，交通便利，配套齐全，成熟小区,海尚康庭,230,http://sh.lianjia.com/ershoufang/sh3318384.html
视野很好，温馨一室，一链倾城，满五年少税,绿星小区,208,http://sh.lianjia.com/ershoufang/sh3902734.html
公元新村 周浦镇中心位置 紧邻地铁 成熟社区,公元新村,230,http://sh.lianjia.com/ershoufang/sh1143088.html
如您所见，满五省税费，来电即看，人气房源,泰安公寓,230,http://sh.lianjia.com/ershoufang/sh4197130.html
视野很好，好房好心情，成熟社区，省装修费,控江西三村,170,http://sh.lianjia.com/ershoufang/sh4154005.html
简约二室，满五年少税，实地看房，高清实拍,浦煤新村,220,http://sh.lianjia.com/ershoufang/sh4203528.html
通河一村，满五税费低，出行方便，热门房源,通河一村,195,http://sh.lianjia.com/ershoufang/sh4153443.html
六村稀缺大一房，边套全明，采光充足,临沂六村,238,http://sh.lianjia.com/ershoufang/sh4224814.html
满5税费少，实地看房，错过不再有，配套完善,赤峰小区,235,http://sh.lianjia.com/ershoufang/sh4191609.html
满5税费少，实地看房，错过不再有，配套完善,赤峰小区,235,http://sh.lianjia.com/ershoufang/sh4191609.html
简约二室，满五年少税，实地看房，高清实拍,浦煤新村,220,http://sh.lianjia.com/ershoufang/sh4203528.html
房东全权委托房源，有租约，看相同户型。,绿地世纪城（酒店式公寓）,208,http://sh.lianjia.com/ershoufang/sh1069157.html
精装小户型，出门地铁站，诚意出售,中二小区,225,http://sh.lianjia.com/ershoufang/sh1854902.html
精品一房，地铁房，生活方便，房型正气，出行方便,柳营路1025弄,210,http://sh.lianjia.com/ershoufang/sh2225924.html
地铁房，配套完善，2室0厅1卫，业主信赖,甘泉二村,175,http://sh.lianjia.com/ershoufang/sh4158838.html
止园路339号，1室1厅1卫，生活很便利，正规成熟小区,止园路339号,200,http://sh.lianjia.com/ershoufang/sh4197658.html
幸福第一公寓，诚意出售，出行方便，满五唯一少税,幸福第一公寓,230,http://sh.lianjia.com/ershoufang/sh4206547.html
精品好房源，南北通，满五诚心出售，拎包入住。,宜川五村,195,http://sh.lianjia.com/ershoufang/sh4053122.html
中心位置的大一房 房东急抛 错过不再有,平阳新村四街坊,240,http://sh.lianjia.com/ershoufang/sh4162858.html
满五唯一少税，上下楼方便，装修精致，上门实拍,翔华新村,240,http://sh.lianjia.com/ershoufang/sh3794568.html
管弄五六街坊，省装修费，高区采光好，上门实拍,管弄五六街坊,175,http://sh.lianjia.com/ershoufang/sh4172307.html
塘桥二村，有爱有家，交通便利，满5唯一减税,塘桥二村,195,http://sh.lianjia.com/ershoufang/sh2004193.html
上门实拍，诚意出售，2室1厅，远离雾霾带,嘉利坊,250,http://sh.lianjia.com/ershoufang/sh4162444.html
一链倾城，交通便利，1室1厅，看房有钥匙,密山二村,200,http://sh.lianjia.com/ershoufang/sh4196557.html
热销好房，吉宅出售，满五唯一少税，来电即看,江海花园,225,http://sh.lianjia.com/ershoufang/sh1094916.html
享受好房，满五唯一少税，空气清新，南北户型,闸园新村,210,http://sh.lianjia.com/ershoufang/sh1165354.html
莲花公寓（普陀），观望后悔莫及，火热出售，景观房,莲花公寓（普陀）,230,http://sh.lianjia.com/ershoufang/sh2232590.html
泗塘五村，有钥匙，热销房源，满五年唯一,泗塘五村,150,http://sh.lianjia.com/ershoufang/sh2198687.html
新南家园，毛坯房，热门房源，景观房,新南家园,230,http://sh.lianjia.com/ershoufang/sh4156980.html
泗塘四村内黄金楼层一室半，随时看房。,泗塘四村,170,http://sh.lianjia.com/ershoufang/sh4203963.html
上门实勘，稀缺房源，错过不再有，满5唯一,吉浦路615弄,193,http://sh.lianjia.com/ershoufang/sh2479383.html
彭五小区，吉宅出售，成熟社区，业主信赖,彭五小区,165,http://sh.lianjia.com/ershoufang/sh3741972.html
彭浦共康四村，小区精品2房，地铁房，拎包入住,共康四村,230,http://sh.lianjia.com/ershoufang/sh3800850.html
银都一村-黄金楼层地铁房....,银都一村（闸北）,180,http://sh.lianjia.com/ershoufang/sh4210570.html
有爱有家，上门实拍，配套完善，抢手火热,民星一村,175,http://sh.lianjia.com/ershoufang/sh4181486.html
单价低，位置好，楼层佳，房型正气,柳营路1025弄,200,http://sh.lianjia.com/ershoufang/sh1060102.html
户型正气朝南的。楼层很好采光也不错！绿地品牌,绿地东海岸时尚广场,180,http://sh.lianjia.com/ershoufang/sh1088289.html
辽源三村，上门实勘，来电即看，热推好房,辽源三村,210,http://sh.lianjia.com/ershoufang/sh2719525.html
上门实拍，投资居住两相宜，低区出入方便，观望后悔莫及,阳光二村,246,http://sh.lianjia.com/ershoufang/sh3043731.html
小区地理位置成熟，房型很正气，交通非常方便,同济里伍街,248,http://sh.lianjia.com/ershoufang/sh3173744.html
上南路3827弄，上门实勘，享受好房，地铁房,上南路3827弄,248,http://sh.lianjia.com/ershoufang/sh3239826.html
中山公园地铁站精装小户型诚售，品质好,新时空国际商务广场,199,http://sh.lianjia.com/ershoufang/sh3910592.html
康平小区，精致户型，好楼层，有爱有家,康平小区,240,http://sh.lianjia.com/ershoufang/sh4109231.html
温馨一室，火爆热销，上门实拍，链家房源,万荣小区,228,http://sh.lianjia.com/ershoufang/sh4183999.html
武宁一村，有钥匙立即看，正规成熟小区，适合自住,武宁一村,250,http://sh.lianjia.com/ershoufang/sh3752624.html
紧邻地铁，小区闹中取静。,宁康小区,190,http://sh.lianjia.com/ershoufang/sh3733097.html
近地铁11号上海西站 黄金楼层一房一厅,真北一街坊,200,http://sh.lianjia.com/ershoufang/sh4213060.html
"黄金楼层，经典一室户,小房精装修，业主诚意出售！",虹南小区,215,http://sh.lianjia.com/ershoufang/sh2851801.html
黄金楼层+经典小户型+配套齐全+徐汇内环,龙山新村,205,http://sh.lianjia.com/ershoufang/sh1076986.html
紧邻地铁，小区闹中取静。,宁康小区,190,http://sh.lianjia.com/ershoufang/sh3733097.html
房型正气 南北通透，板式房型，全明户型,龙南七村,210,http://sh.lianjia.com/ershoufang/sh4114676.html
交通便利，正规成熟小区，随到随看，火爆热销,民主花园,250,http://sh.lianjia.com/ershoufang/sh1086739.html
密山二村 楼层好 房型正气 白金二楼,密山二村,182,http://sh.lianjia.com/ershoufang/sh2947161.html
吉浦路615弄，正规成熟小区，温馨一室，光线充足,吉浦路615弄,225,http://sh.lianjia.com/ershoufang/sh1086011.html
采光好，热销房源，小户型，上门实拍,闸殷小区,160,http://sh.lianjia.com/ershoufang/sh4209655.html
彭豪公寓，南北通透，高清实拍，低楼层,彭豪公寓,250,http://sh.lianjia.com/ershoufang/sh4212150.html
温馨之家，交通便利，景观房，正规成熟小区,阳光城MODO自由区,185,http://sh.lianjia.com/ershoufang/sh1094643.html
小户型，主卧朝南，楼层好，老人小孩适宜,三门路489弄,225,http://sh.lianjia.com/ershoufang/sh1065327.html
链家房源，看房看疯了，景观房，温馨之家,甘泉三村,168,http://sh.lianjia.com/ershoufang/sh1110767.html
8号地铁旁，主卧朝南，厨卫朝北，南北通透。,国和二村,195,http://sh.lianjia.com/ershoufang/sh1117339.html
乾溪新村，如您所见，两室户，满五唯一少税,乾溪新村,220,http://sh.lianjia.com/ershoufang/sh1131857.html
新领地，黄金楼层，正规成熟小区，链家房源,新领地,250,http://sh.lianjia.com/ershoufang/sh1142332.html
密三小区 朝南一室户 目前低价就这一套,密三小区,185,http://sh.lianjia.com/ershoufang/sh1145306.html
临河而建，衣带缠腰，标准1室户，主卧朝南,四平路421弄,168,http://sh.lianjia.com/ershoufang/sh1151659.html
热门房源，小户型，满五年唯一，景观房,眉州路515弄,150,http://sh.lianjia.com/ershoufang/sh1164570.html
银龙小区  精致小三房  南北通透  置换急售,银龙小区,240,http://sh.lianjia.com/ershoufang/sh1700441.html
延吉五村，热推好房，高清实拍，满五年唯一,延吉五村,195,http://sh.lianjia.com/ershoufang/sh1809361.html
金杨新村四街坊，1室1厅，成熟社区，满五唯一少税,金杨新村四街坊,245,http://sh.lianjia.com/ershoufang/sh1820043.html
精品一房，中心位置，诚意出售,梅陇三村,160,http://sh.lianjia.com/ershoufang/sh1940189.html
配套完善，光线非常好，装修精致，高清实拍,金坤花园,150,http://sh.lianjia.com/ershoufang/sh3876771.html
诚意出售+双南双天井+徐汇中心地段,天钥新村,230,http://sh.lianjia.com/ershoufang/sh4172832.html
敦化路6弄，紧邻地铁，链家好房，景观房,敦化路6弄,170,http://sh.lianjia.com/ershoufang/sh4180460.html
银都新村精致两房诚心出售,银都新村（8至10区）,240,http://sh.lianjia.com/ershoufang/sh4180825.html
满五唯一 边套南北通 稀缺小户型  产权清晰,洛川中路1100弄,198,http://sh.lianjia.com/ershoufang/sh4181461.html
航华一村，上下楼方便，一室小户型，真实在售,航华一村,170,http://sh.lianjia.com/ershoufang/sh4186093.html
梅陇三村，满五年唯一，温馨一室，配套完善,梅陇三村,190,http://sh.lianjia.com/ershoufang/sh4202368.html
兴泉小区，上门实勘，出行方便，抢手火热,兴泉小区,210,http://sh.lianjia.com/ershoufang/sh4203132.html
龙潭小区 新出一房 婚房装修 拎包入住,龙潭小区,205,http://sh.lianjia.com/ershoufang/sh4221545.html
小户型，主卧朝南，楼层好，老人小孩适宜,三门路489弄,225,http://sh.lianjia.com/ershoufang/sh1065327.html
链家房源，看房看疯了，景观房，温馨之家,甘泉三村,168,http://sh.lianjia.com/ershoufang/sh1110767.html
8号地铁旁，主卧朝南，厨卫朝北，南北通透。,国和二村,195,http://sh.lianjia.com/ershoufang/sh1117339.html
乾溪新村，如您所见，两室户，满五唯一少税,乾溪新村,220,http://sh.lianjia.com/ershoufang/sh1131857.html
新领地，黄金楼层，正规成熟小区，链家房源,新领地,250,http://sh.lianjia.com/ershoufang/sh1142332.html
密三小区 朝南一室户 目前低价就这一套,密三小区,185,http://sh.lianjia.com/ershoufang/sh1145306.html
临河而建，衣带缠腰，标准1室户，主卧朝南,四平路421弄,168,http://sh.lianjia.com/ershoufang/sh1151659.html
热门房源，小户型，满五年唯一，景观房,眉州路515弄,150,http://sh.lianjia.com/ershoufang/sh1164570.html
银龙小区  精致小三房  南北通透  置换急售,银龙小区,240,http://sh.lianjia.com/ershoufang/sh1700441.html
延吉五村，热推好房，高清实拍，满五年唯一,延吉五村,195,http://sh.lianjia.com/ershoufang/sh1809361.html
金杨新村四街坊，1室1厅，成熟社区，满五唯一少税,金杨新村四街坊,245,http://sh.lianjia.com/ershoufang/sh1820043.html
