上南一村，满五唯一，清流名校，近地铁，随时看房,上南一村,240,http://sh.lianjia.com/ershoufang/sh3013827.html
临近地铁 诚意出售 看房方便,西藏北路979号,195,http://sh.lianjia.com/ershoufang/sh3029710.html
双天井，满五唯一，直接入住,三门路510弄,230,http://sh.lianjia.com/ershoufang/sh3046658.html
上门实拍，采光好，有爱有家，满五唯一少税,塘桥路223弄,248,http://sh.lianjia.com/ershoufang/sh3063587.html
本小区正规一室户，精装修，可以拎包入住！,昭化小区,235,http://sh.lianjia.com/ershoufang/sh3099893.html
世博板块 正规一房一厅 成熟小区 交通方便,上钢一村,210,http://sh.lianjia.com/ershoufang/sh3123702.html
房东诚意出售   浅谈辐射区   黄金楼层,凌兆新村（凌兆路586弄）,235,http://sh.lianjia.com/ershoufang/sh3189504.html
生活很便利，享受好房，满五唯一少税，高区景观房,曹杨五村,220,http://sh.lianjia.com/ershoufang/sh3192937.html
赤峰小区，品质小区周边配套成熟，交通出行方便。,赤峰小区,225,http://sh.lianjia.com/ershoufang/sh3200134.html
曹杨五村，南北通透，采光好，黄金地段，交通便利！,曹杨五村,230,http://sh.lianjia.com/ershoufang/sh3214110.html
一室小户型，上门实勘，吉宅出售，地铁沿线,南泉苑,200,http://sh.lianjia.com/ershoufang/sh3260503.html
南北通两房一厅 带采光天井 精装全配,宜川二村,236,http://sh.lianjia.com/ershoufang/sh3260775.html
经典一室半 满五唯一  免营业税和个税,田林六村,240,http://sh.lianjia.com/ershoufang/sh3266067.html
淞虹路地铁口毛坯房 方便装修,新泾七村,215,http://sh.lianjia.com/ershoufang/sh3320071.html
省装修费，成熟社区，高区景观房，上门实勘,东一小区,240,http://sh.lianjia.com/ershoufang/sh3658850.html
新凯家园稀缺的一室，黄金楼层，采光好！,新凯家园（一期）,180,http://sh.lianjia.com/ershoufang/sh3666734.html
中环内地铁房+满五年+看房方便+诚心出售,天池二村,225,http://sh.lianjia.com/ershoufang/sh3714279.html
上门实拍，紧邻地铁，满5唯一减税，正规成熟小区,寿昌坊,220,http://sh.lianjia.com/ershoufang/sh3714637.html
丰庄一村，上门实勘，光线充足，人气房源,丰庄一村,250,http://sh.lianjia.com/ershoufang/sh3714641.html
精装地铁房，满五年唯一，免征个税，配套完善,水岸金桥苑,248,http://sh.lianjia.com/ershoufang/sh3756843.html
临近轨道地铁12号线 3号线 房型正气小户型,上缝小区,250,http://sh.lianjia.com/ershoufang/sh3772422.html
简约二室，有爱有家，热门带看，满5唯一减税,控江五村,240,http://sh.lianjia.com/ershoufang/sh3785553.html
稀缺一室半 业主诚心出售 随时配合看房,远洋新村,225,http://sh.lianjia.com/ershoufang/sh3809838.html
满五年唯一，采光无遮挡，上门实勘，如您所见,柳营路319弄,165,http://sh.lianjia.com/ershoufang/sh3831895.html
观望后悔莫及，满五唯一少税，两室户，上门实勘,梅林小区,240,http://sh.lianjia.com/ershoufang/sh3848915.html
精装修，南北通，上家无税，芳龄新,昌五小区,210,http://sh.lianjia.com/ershoufang/sh3880805.html
生活很便利，配套完善，满5唯一减税，3房出售,荣乐四村,228,http://sh.lianjia.com/ershoufang/sh3892692.html
两室户，地铁直达，热门带看，配套完善,丰庄十二街坊,245,http://sh.lianjia.com/ershoufang/sh3913294.html
南泉苑 环境好 文明小区 近地铁,南泉苑,200,http://sh.lianjia.com/ershoufang/sh4053153.html
德怡苑精装一室户，高楼层，采光充足。,德怡苑,245,http://sh.lianjia.com/ershoufang/sh4074996.html
场中路2401弄，简装1房，邻近地铁,场中路2401弄,180,http://sh.lianjia.com/ershoufang/sh4093070.html
金光小区 标准小户型 得房率高 真正的地铁房,金光小区,240,http://sh.lianjia.com/ershoufang/sh4093585.html
彭顺小区，南北直通，上门实拍，满五唯一少税,彭顺小区,250,http://sh.lianjia.com/ershoufang/sh4105958.html
东西朝向，主卧朝东，厨房卫生间朝西,宜川四村,210,http://sh.lianjia.com/ershoufang/sh4106305.html
零陵路350弄，高清实拍，一链倾城，地铁沿线,零陵路350弄,235,http://sh.lianjia.com/ershoufang/sh4108293.html
温馨之家，成熟社区，出行方便，满五唯一少税,闸殷小区,180,http://sh.lianjia.com/ershoufang/sh4132518.html
急！地铁十号线，黄金楼层，精装修，业主置换急售！,虹日小区,235,http://sh.lianjia.com/ershoufang/sh4152148.html
童家浜小区 全南户型 居家装修 房型正气,童家浜小区,235,http://sh.lianjia.com/ershoufang/sh4155238.html
金杨二街坊，采光无敌好，1室1厅，满5唯一减税,金杨二街坊,250,http://sh.lianjia.com/ershoufang/sh4155443.html
全明两室户，近地铁，采光好无遮挡,平顺路980弄,228,http://sh.lianjia.com/ershoufang/sh4156835.html
上门实拍，1室1厅，出行方便，配套完善,昌五小区,240,http://sh.lianjia.com/ershoufang/sh4157510.html
童家浜小区 全南户型 房型正气 看房方便,童家浜小区,189,http://sh.lianjia.com/ershoufang/sh4160168.html
满五年唯一，黄金楼层，享受好房，上门实拍,真如西村,190,http://sh.lianjia.com/ershoufang/sh4163468.html
地铁旁 南北通 全明小户型,眉州路515弄,210,http://sh.lianjia.com/ershoufang/sh4170438.html
大华一村，热门房源，正规成熟小区，满5唯一减税,大华一村,250,http://sh.lianjia.com/ershoufang/sh4176887.html
万东小区，上门实勘，温馨一室，出行方便,万东小区,170,http://sh.lianjia.com/ershoufang/sh4181038.html
通河一村，成熟社区，有爱有家，实地看房,通河一村,195,http://sh.lianjia.com/ershoufang/sh4184042.html
精装修，实地看房，如您所见，2室0厅1卫,内江二村,220,http://sh.lianjia.com/ershoufang/sh4184545.html
满五年唯一，地铁房，温馨之家，实地看房,靖宇南路5弄,250,http://sh.lianjia.com/ershoufang/sh4192965.html
共富二村，2室1厅1卫，链家精选，地铁房,共富二村,235,http://sh.lianjia.com/ershoufang/sh4193934.html
精装修拎包入住产权清晰开放式厨房全明户型满五唯一,呼玛四村,245,http://sh.lianjia.com/ershoufang/sh4196667.html
好房好心情，1室1厅，视野开阔，地铁直达,通河一村,195,http://sh.lianjia.com/ershoufang/sh4197983.html
延吉东路555弄，出行方便，温馨之家，成熟社区,延吉东路555弄,210,http://sh.lianjia.com/ershoufang/sh4199499.html
上门实拍，2室1厅，采光这边独好，南北通,银都新村（8至10区）,235,http://sh.lianjia.com/ershoufang/sh4202438.html
上南四村，上下楼方便，高清实拍，1室1厅1卫,上南四村,210,http://sh.lianjia.com/ershoufang/sh4203685.html
番禺路222弄，成熟社区，高清实拍，温馨之家,番禺路222弄,248,http://sh.lianjia.com/ershoufang/sh4204945.html
海高一村，满5唯一减税，视野很好，生活很便利,海高一村,230,http://sh.lianjia.com/ershoufang/sh4207236.html
中环内小一房 简单装修 满五年 诚意出售。,水电路645弄,225,http://sh.lianjia.com/ershoufang/sh4207869.html
成熟社区，一链倾城，实地看房，上门实拍,共富一村,225,http://sh.lianjia.com/ershoufang/sh4208999.html
前排位置精装两房 满五减税 出行便利 随时可看,金都雅苑（公寓）,249,http://sh.lianjia.com/ershoufang/sh4209880.html
内环8号线，91年小区黄金楼层,通阁小区,160,http://sh.lianjia.com/ershoufang/sh4211920.html
霍新小区，温馨之家，低楼层，装修精美,霍新小区,190,http://sh.lianjia.com/ershoufang/sh4212028.html
好楼层，1室1厅，享受好房，人气房源,葑润华庭,210,http://sh.lianjia.com/ershoufang/sh4213941.html
地铁沿线，配套完善，实地看房，错过不再有,双阳路507号,185,http://sh.lianjia.com/ershoufang/sh4113933.html
黄金楼层+精品小一房+业主诚意出售,欣绿小区,250,http://sh.lianjia.com/ershoufang/sh3060005.html
宛南六村，放心好房，满5唯一减税，正规成熟小区,宛南六村,230,http://sh.lianjia.com/ershoufang/sh3087963.html
闹中取静，满5唯一减税，成熟社区，实地看房,凌云新村,240,http://sh.lianjia.com/ershoufang/sh4171033.html
桃浦七村雪松苑，品质装修，精致户型，高区景观房,桃浦七村雪松苑,215,http://sh.lianjia.com/ershoufang/sh1532045.html
洛川中路1100弄闸北实验小学近地铁1号线,洛川中路1100弄,195,http://sh.lianjia.com/ershoufang/sh3147626.html
紫祥小区，满五年唯一，生活很便利，放心好房,紫祥小区,200,http://sh.lianjia.com/ershoufang/sh1844170.html
高境一村，正气大一房，满五唯一，诚意出售,高境二村,245,http://sh.lianjia.com/ershoufang/sh1060683.html
学前一村 地铁房 南北小两房 全明,学前一村,185,http://sh.lianjia.com/ershoufang/sh4206216.html
丽景新苑，吉宅出售，上门实勘，满5唯一减税,丽景新苑,250,http://sh.lianjia.com/ershoufang/sh3213617.html
配套完善，满五唯一少税，视野开阔，1室1厅1卫,芷江西路453弄,200,http://sh.lianjia.com/ershoufang/sh4162276.html
黄金楼层采光通风好、精装 。,凤城四村,230,http://sh.lianjia.com/ershoufang/sh3207576.html
绿地公园氧吧，交通穿在两条轻轨，1号线、8号线,唐家沙小区,170,http://sh.lianjia.com/ershoufang/sh4094375.html
上大东村，正规成熟小区，满五唯一少税，热门房源,上大东村,210,http://sh.lianjia.com/ershoufang/sh3016880.html
配套完善，南北通透，1室1厅，放心好房,逸仙路1321弄小区,180,http://sh.lianjia.com/ershoufang/sh4185634.html
视野很好，满五唯一少税，人气房源，简约二室,银都一村（闸北）,248,http://sh.lianjia.com/ershoufang/sh4209742.html
"临近地铁，小户型低总价,黄金楼层，置换诚意出售",新风小区,200,http://sh.lianjia.com/ershoufang/sh4180165.html
满五唯一少税，正规成熟小区，链家房源，小户型,西宝兴路949弄,200,http://sh.lianjia.com/ershoufang/sh3175999.html
全明户型 东边套 地铁房 成熟小区,平顺路980弄,190,http://sh.lianjia.com/ershoufang/sh2121241.html
人气房源，稀罕南北通，好房好心情，一室小户型,吴家湾路52弄,215,http://sh.lianjia.com/ershoufang/sh1926209.html
真实在售，适合自住，新出房源，正规成熟小区,航华四村,240,http://sh.lianjia.com/ershoufang/sh4193293.html
配套完善，好房好心情，上门实勘，满五年唯一,崂山二村,210,http://sh.lianjia.com/ershoufang/sh3878825.html
一链倾城，房型正气，上门实勘，正规成熟小区,桃浦一村瑞香苑,185,http://sh.lianjia.com/ershoufang/sh1123452.html
大西小区，满5唯一减税，高清实拍，人气房源,大西小区,230,http://sh.lianjia.com/ershoufang/sh4174541.html
丰庄六街坊，温馨之家，正规成熟小区，视野很好,丰庄六街坊,205,http://sh.lianjia.com/ershoufang/sh2861955.html
盘古路927弄，热门房源，交通便利，满5唯一减税,盘古路927弄,170,http://sh.lianjia.com/ershoufang/sh3662866.html
成熟社区，热门带看，链家房源，高清实拍,控江路645弄,240,http://sh.lianjia.com/ershoufang/sh2047119.html
经典一房，黄金楼层，采光好，精装修。,文化名园,250,http://sh.lianjia.com/ershoufang/sh4207396.html
经典居家小两房，南北全明东边套，满五年唯一！,航华一村,239,http://sh.lianjia.com/ershoufang/sh2546056.html
洛川路8号，热门带看，低楼层，满五唯一少税,洛川路8号,220,http://sh.lianjia.com/ershoufang/sh2691035.html
热门房源，满五唯一少税，正规成熟小区，一室小户型,隆德小区,250,http://sh.lianjia.com/ershoufang/sh4212753.html
毗邻地铁，成熟社区，光线充足，省装修费,共和三村,205,http://sh.lianjia.com/ershoufang/sh3296895.html
菊泉新城（菊盛路50弄），采光好，一链倾城，实地看房,菊泉新城（菊盛路50弄）,230,http://sh.lianjia.com/ershoufang/sh4218783.html
上门实拍，近地铁，人气房源，高区景观房,洛川路8号,180,http://sh.lianjia.com/ershoufang/sh1813339.html
低楼层，上门实勘，热门房源，成熟社区,兰溪路234号,190,http://sh.lianjia.com/ershoufang/sh2137353.html
房子满五年、唯一一套，单价感人。,闻喜路1110弄,220,http://sh.lianjia.com/ershoufang/sh2654181.html
紧邻地铁，精致户型，人气房源，享受好房,沪南船舶小区,246,http://sh.lianjia.com/ershoufang/sh2863458.html
共康六村，正规成熟小区，好房好心情，上门实拍,共康六村,240,http://sh.lianjia.com/ershoufang/sh4181825.html
岚灵小区，满五唯一少税，成熟社区，1室1厅1卫,岚灵小区,245,http://sh.lianjia.com/ershoufang/sh4156890.html
1室0厅，成熟社区，交通方便，热门带看,水电路108弄,200,http://sh.lianjia.com/ershoufang/sh4180541.html
长顺路50弄，观望后悔莫及，钥匙房，近地铁,长顺路50弄,215,http://sh.lianjia.com/ershoufang/sh4213245.html
虹口足球场一房带九平天井，可改两房，周边配套齐全,水电路108弄,190,http://sh.lianjia.com/ershoufang/sh3806492.html
上门实拍，南北直通，景观房，实地看房,同济路191弄,179,http://sh.lianjia.com/ershoufang/sh3911321.html
高清实拍，一链倾城，满五年唯一，交通方便,通河一村,250,http://sh.lianjia.com/ershoufang/sh2961448.html
满5唯一减税，人气房源，上门实勘，小户型,汪家井小区,205,http://sh.lianjia.com/ershoufang/sh4208299.html
新挂牌，精致户型享受无限阳光生活。。,呼玛二村,230,http://sh.lianjia.com/ershoufang/sh4207137.html
热门带看，配套完善，链家房源，稀缺南北通,罗南二村,170,http://sh.lianjia.com/ershoufang/sh2536369.html
保德公寓，近地铁，链家好房，上门实拍,保德公寓,230,http://sh.lianjia.com/ershoufang/sh1676221.html
"交通方便，房东诚心出售,采光好",保德公寓,230,http://sh.lianjia.com/ershoufang/sh2602961.html
热门带看，适合自住，光线非常好，上门实勘,庆安苑,240,http://sh.lianjia.com/ershoufang/sh3074845.html
简约二室，如您所见，高区景观好，出行方便,吉浦路615弄,245,http://sh.lianjia.com/ershoufang/sh4191039.html
小户型，配套完善，热门房源，上门实勘,永吉路97弄,217,http://sh.lianjia.com/ershoufang/sh3835006.html
亚龙国际大厦，满五唯一少税，热门房源，上下楼方便,亚龙国际大厦,200,http://sh.lianjia.com/ershoufang/sh4137219.html
正规成熟小区，地铁沿线，上门实拍，空气清新,东风小区（江川路）,150,http://sh.lianjia.com/ershoufang/sh4209713.html
乐业二村，黄金楼层，适合自住，正规成熟小区,乐业二村,220,http://sh.lianjia.com/ershoufang/sh4182096.html
视野很好，满五唯一少税，人气房源，简约二室,银都一村（闸北）,248,http://sh.lianjia.com/ershoufang/sh4209742.html
宝林二村，正规成熟小区，满五唯一少税，南北户型,宝林二村,235,http://sh.lianjia.com/ershoufang/sh4191805.html
幸福新苑，热门带看，上门实拍，1室0厅1卫,幸福新苑,200,http://sh.lianjia.com/ershoufang/sh4212494.html
闸北实验，黄金楼层，房型正气，配套齐全，交通便利,老沪太路270号,240,http://sh.lianjia.com/ershoufang/sh2470169.html
上下楼方便，高清实拍，真实在售，热门房源,沧州路180弄,245,http://sh.lianjia.com/ershoufang/sh4169493.html
南北两房，交通便利，采光全天,平顺路790弄,220,http://sh.lianjia.com/ershoufang/sh3711990.html
省装修费，出行方便，空气清新，正规成熟小区,翔殷路491弄,200,http://sh.lianjia.com/ershoufang/sh4150380.html
控江路1200弄，1室0厅1卫，黄金楼层，正规成熟小区,控江路1200弄,185,http://sh.lianjia.com/ershoufang/sh4073178.html
六楼、东边套、可在房间内看日出,南新六村（下南路500弄）,205,http://sh.lianjia.com/ershoufang/sh4180427.html
新挂牌，精致户型享受无限阳光生活。。,呼玛二村,230,http://sh.lianjia.com/ershoufang/sh4207137.html
宜川六村西边套，全明户型,宜川六村,175,http://sh.lianjia.com/ershoufang/sh4211393.html
低楼层，出行方便，满五唯一少税，一室小户型,幸福第一公寓,168,http://sh.lianjia.com/ershoufang/sh4201543.html
长顺路50弄，观望后悔莫及，钥匙房，近地铁,长顺路50弄,215,http://sh.lianjia.com/ershoufang/sh4213245.html
共康六村，正规成熟小区，好房好心情，上门实拍,共康六村,240,http://sh.lianjia.com/ershoufang/sh4181825.html
链家房源，成熟社区，高清实拍，实地看房,信仪新村,220,http://sh.lianjia.com/ershoufang/sh4125757.html
香山新村东北街坊，上门实勘，温馨一室，成熟社区,香山新村东北街坊,230,http://sh.lianjia.com/ershoufang/sh4201067.html
宝钢十一村，链家好房，配套完善，上下楼方便,宝钢十一村,210,http://sh.lianjia.com/ershoufang/sh3686488.html
交通方便，适合自住，满五唯一少税，上门实勘,宝钢十一村,210,http://sh.lianjia.com/ershoufang/sh2203672.html
满5唯一减税，人气房源，上门实勘，小户型,汪家井小区,205,http://sh.lianjia.com/ershoufang/sh4208299.html
配套完善，视野很好，满5唯一减税，品质装修,逸仙二村,212,http://sh.lianjia.com/ershoufang/sh4194222.html
惠民公寓，热门带看，高清实拍，两室户,惠民公寓,250,http://sh.lianjia.com/ershoufang/sh3190166.html
高清实拍，一链倾城，满五年唯一，交通方便,通河一村,250,http://sh.lianjia.com/ershoufang/sh2961448.html
业主上门挂牌，南北两房，一梯两户，寻找有缘人。,红旗三村,180,http://sh.lianjia.com/ershoufang/sh1150166.html
兰花新村双南两房，业主诚意出售，小区总价实惠两房,兰花新村,245,http://sh.lianjia.com/ershoufang/sh3019944.html
热门带看，配套完善，链家房源，稀缺南北通,罗南二村,170,http://sh.lianjia.com/ershoufang/sh2536369.html
精装黄金楼层 一房一厅 业主很诚意 看房方便,兰花新村,240,http://sh.lianjia.com/ershoufang/sh2180141.html
"黄金楼层,近地铁,满五唯一,随时看房",金杨新村三街坊,250,http://sh.lianjia.com/ershoufang/sh2408863.html
海滨八村，一链倾城，实地看房，小户型,海滨八村,154,http://sh.lianjia.com/ershoufang/sh1146242.html
地铁公交家门口，菜场便利店300米，黄金楼层,虹桥小区,250,http://sh.lianjia.com/ershoufang/sh4201068.html
高区景观好，高清实拍，精致户型，满五年唯一,海滨三村,190,http://sh.lianjia.com/ershoufang/sh3832789.html
满五年唯一，真实在售，精致户型，毗邻地铁,海滨四村,245,http://sh.lianjia.com/ershoufang/sh2724211.html
上门实勘，正规成熟小区，地铁沿线，1室1厅1卫,沪南船舶小区,235,http://sh.lianjia.com/ershoufang/sh2552624.html
宝林一村，经典南北两房出售，黄金楼层，,宝林一村,250,http://sh.lianjia.com/ershoufang/sh3679309.html
红旗四街坊  标准小户型  舒适住家,红旗四街坊,150,http://sh.lianjia.com/ershoufang/sh2235568.html
繁华地段 小区中心 出行方便,宝钢二村,158,http://sh.lianjia.com/ershoufang/sh2780404.html
盘古路927弄，正规成熟小区，精致户型，地铁沿线,盘古路927弄,165,http://sh.lianjia.com/ershoufang/sh4171483.html
红旗四街坊  标准小户型  舒适住家,红旗四街坊,150,http://sh.lianjia.com/ershoufang/sh2235568.html
南北通简单装修一房，看房方便,沁春园一村,245,http://sh.lianjia.com/ershoufang/sh3756898.html
满五年唯一，热门房源，1室1厅，上门实拍,博三小区,230,http://sh.lianjia.com/ershoufang/sh2109564.html
宝林一村，经典南北两房出售，黄金楼层，,宝林一村,250,http://sh.lianjia.com/ershoufang/sh3679309.html
香山新村东北街坊，上门实勘，温馨一室，成熟社区,香山新村东北街坊,230,http://sh.lianjia.com/ershoufang/sh4201067.html
拎包入住，热门房源，如您所见，配套完善,幸福新苑,240,http://sh.lianjia.com/ershoufang/sh3664646.html
地铁公交家门口，菜场便利店300米，黄金楼层,虹桥小区,250,http://sh.lianjia.com/ershoufang/sh4201068.html
交通便利，吉宅出售，满五年唯一，高区阳光房,宝钢三村,208,http://sh.lianjia.com/ershoufang/sh3194610.html
旬阳新村，满5唯一减税，1室1厅1卫，地铁房,旬阳新村,190,http://sh.lianjia.com/ershoufang/sh3649591.html
光复西路145弄，上门实勘，交通方便，成熟小区,光复西路145弄,225,http://sh.lianjia.com/ershoufang/sh3834960.html
地铁直达，链家房源，拎包入住，热门房源,中大苑,230,http://sh.lianjia.com/ershoufang/sh4209467.html
杨家宅小区，成熟社区，交通方便，小户型,杨家宅小区,200,http://sh.lianjia.com/ershoufang/sh2436542.html
满五省税费，小户型，采光这边独好，上门实拍,临沂一村,240,http://sh.lianjia.com/ershoufang/sh4213063.html
经典户型 房型正气 厅房同宽 全天彩光好,逸仙一村,170,http://sh.lianjia.com/ershoufang/sh1156376.html
1室0厅1卫，紧邻地铁，空气清新，满五年唯一,银龙新村,210,http://sh.lianjia.com/ershoufang/sh3235824.html
曹杨五村 一梯两户 大的一室户 房东诚意出售,曹杨五村,240,http://sh.lianjia.com/ershoufang/sh3826836.html
配套完善，豪华装修，满五年唯一，1室1厅1卫,民星二村,220,http://sh.lianjia.com/ershoufang/sh4167084.html
吉宅出售黄金楼层精装全配 精致朝南一门关 稀缺！,内江路482号,193,http://sh.lianjia.com/ershoufang/sh1095961.html
一室小户型，满五年唯一，实地看房，上门实拍,虹二小区,230,http://sh.lianjia.com/ershoufang/sh4093964.html
品质装修，景观房，满5唯一减税，放心好房,栖山小区,250,http://sh.lianjia.com/ershoufang/sh2773074.html
桃浦五村杜鹃苑，省装修费，满五年唯一，地铁房,桃浦五村杜鹃苑,235,http://sh.lianjia.com/ershoufang/sh4224389.html
成熟配套小区，生活方便，交通便利,宜川六村,215,http://sh.lianjia.com/ershoufang/sh2571449.html
稀缺1室半，南北通透，黄金地段，品质小区！,曹杨五村,215,http://sh.lianjia.com/ershoufang/sh1792998.html
闹中取静，热门房源，上门实拍，简约二室,共康四村,250,http://sh.lianjia.com/ershoufang/sh4075724.html
满五省税费，链家好房，高清实拍，抢手火热,淞南一村,230,http://sh.lianjia.com/ershoufang/sh1104007.html
优质好房 低价诚意出售 配套曹杨二中附校,怒江新村,190,http://sh.lianjia.com/ershoufang/sh3737355.html
桂巷新村，一楼带天井，诚意出售,桂巷新村,170,http://sh.lianjia.com/ershoufang/sh4164806.html
全明一房，房型正气，采光一流，南北通透，客厅带窗,阳曲小区,190,http://sh.lianjia.com/ershoufang/sh4168414.html
小区中心位置 房型正气采光好,华泾四村,195,http://sh.lianjia.com/ershoufang/sh4189221.html
业主诚意出售，实地看房，链家房源，满五年唯一,玉田新村,155,http://sh.lianjia.com/ershoufang/sh4209640.html
成熟社区，吉宅出售，上下楼方便，满5税费少,沙申新村,210,http://sh.lianjia.com/ershoufang/sh1414454.html
一室半，黄金楼层，有钥匙随时看房,淞南八村,190,http://sh.lianjia.com/ershoufang/sh4155196.html
中信泰富朱家角新城（公寓），如您所见，南北直通，高清实拍,中信泰富朱家角新城（公寓）,235,http://sh.lianjia.com/ershoufang/sh1160338.html
好房好心情，两室户，业主诚意出售，正规成熟小区,殷行路310弄,240,http://sh.lianjia.com/ershoufang/sh3886773.html
链家好房，链家精选，成熟社区，热门带看,翔殷路491弄,200,http://sh.lianjia.com/ershoufang/sh2163418.html
景观房，南北户型，没装修过，看房看疯了,上坤公园天地（商住）,170,http://sh.lianjia.com/ershoufang/sh1398932.html
有钥匙看房方便，全明户型，位置好,龙吴路5599弄,220,http://sh.lianjia.com/ershoufang/sh4188604.html
2房朝南，采光好，文明小区，,合阳小区,225,http://sh.lianjia.com/ershoufang/sh1096053.html
热门带看，小户型，紧邻地铁，上门实拍,山三小区,235,http://sh.lianjia.com/ershoufang/sh1082554.html
临汾路1515弄，精致双南户型全明采光好诚心出售,临汾路1515弄,240,http://sh.lianjia.com/ershoufang/sh1118084.html
南北两房，厨卫朝北带厅，交通便利配套完善,平顺路825弄,235,http://sh.lianjia.com/ershoufang/sh4193884.html
凤城二村，朝南一门关 近地铁8号线,凤城二村,215,http://sh.lianjia.com/ershoufang/sh4150649.html
独门独户 一门关 业主急售 单价低 近地铁,日晖六村,188,http://sh.lianjia.com/ershoufang/sh1087596.html
曙光南桥小区 老装修 满五不唯一 53中学,曙光南桥小区,230,http://sh.lianjia.com/ershoufang/sh1097796.html
低楼层，成熟社区，满5税费少，2室1厅,控江四村,230,http://sh.lianjia.com/ershoufang/sh1112462.html
延吉六村，正规朝南一室户，东山墙全明。,延吉六村,235,http://sh.lianjia.com/ershoufang/sh1122871.html
近地铁，近百联，近医院，周围生活便利,永馨小区,210,http://sh.lianjia.com/ershoufang/sh1139240.html
上门实拍，温馨一室，无装修，链家房源,虹一小区,215,http://sh.lianjia.com/ershoufang/sh1564347.html
稀缺抢手两房，带看量高，房东诚心出售,高南新村,250,http://sh.lianjia.com/ershoufang/sh1724143.html
银凤小区南北通透精装修黄金楼层华夏西校,银凤小区,250,http://sh.lianjia.com/ershoufang/sh1821309.html
