寿山坊，生活很便利，正规成熟小区，满五年唯一,寿山坊,235,http://sh.lianjia.com/ershoufang/sh4208280.html
小户型，空气清新，配套完善，享受好房,控江路680弄,170,http://sh.lianjia.com/ershoufang/sh4197705.html
近地铁，出行方便，小区环境好,靖宇东路85弄,230,http://sh.lianjia.com/ershoufang/sh4169967.html
延吉六村，朝南一房一厅一卫，居家装修,延吉六村,185,http://sh.lianjia.com/ershoufang/sh4194435.html
全明一房，黄金3楼，房型非常好，基本无可挑剔。,荷五小区,235,http://sh.lianjia.com/ershoufang/sh4200470.html
稀缺一房、配套成熟、6.8.11号三轨相交,南杨小区（长清路）,235,http://sh.lianjia.com/ershoufang/sh3895084.html
南北两房，满五年，精装修，采光全明,市光三村,240,http://sh.lianjia.com/ershoufang/sh4210910.html
上门实拍，小户型，紧邻地铁，观望后悔莫及,上南四村,230,http://sh.lianjia.com/ershoufang/sh4104703.html
原始毛坯三房，房东诚心出售，看房有钥匙,民风小区,250,http://sh.lianjia.com/ershoufang/sh1151645.html
红旗小区，成熟社区，上门实拍，南北户型,红旗小区,180,http://sh.lianjia.com/ershoufang/sh4203518.html
上门实拍，配套完善，黄金楼层，简约二室,东风二村,190,http://sh.lianjia.com/ershoufang/sh4210856.html
桃浦六村绿春苑，正规成熟小区，视野很好，如您所见,桃浦六村绿春苑,250,http://sh.lianjia.com/ershoufang/sh2816384.html
满5唯一减税，高区阳光房，上门实勘，温馨一室,信仪新村,225,http://sh.lianjia.com/ershoufang/sh4213763.html
梅六小区，一链倾城，高清实拍，温馨一室,梅六小区,230,http://sh.lianjia.com/ershoufang/sh4186421.html
上门实勘，采光无敌好，链家好房，地铁直达,金杨新村十街坊,210,http://sh.lianjia.com/ershoufang/sh4189778.html
新四村小户型地段位置堪比优地铁500米,通河四村,180,http://sh.lianjia.com/ershoufang/sh4185015.html
上门实拍，地铁房，正规成熟小区，满五唯一少税,港机新村,230,http://sh.lianjia.com/ershoufang/sh4198429.html
罗山三村，1室1厅1卫，满五年唯一，地铁房,罗山三村,240,http://sh.lianjia.com/ershoufang/sh4171991.html
南北两房，彩光无遮挡，价格有空间,曹杨九村,245,http://sh.lianjia.com/ershoufang/sh4206902.html
新出笋盘，精装修，楼层好，地段好，位置佳好房子,管弄五六街坊,230,http://sh.lianjia.com/ershoufang/sh4205730.html
新闵小区2房1厅1卫1阳南北通透采光好,新闵小区,190,http://sh.lianjia.com/ershoufang/sh2202673.html
出行方便 周边配套齐全 靠近地铁站,真如西村,200,http://sh.lianjia.com/ershoufang/sh4193052.html
曹杨三村，上门实勘，毗邻地铁，温馨之家,曹杨三村,185,http://sh.lianjia.com/ershoufang/sh2733547.html
地铁直达，真实在售，满五年唯一，高清实拍,引翔港小区,190,http://sh.lianjia.com/ershoufang/sh4199132.html
田林三村 邻漕河泾 毗邻徐家汇,田林三村,225,http://sh.lianjia.com/ershoufang/sh4198480.html
装修精美，高清实拍，有爱有家，好楼层,东一小区,240,http://sh.lianjia.com/ershoufang/sh4208581.html
精装修一房，楼层好，采光充足，户型正，临近地铁,海尚乐苑,230,http://sh.lianjia.com/ershoufang/sh4195817.html
杨思板块8号线地铁口，小户型送天井利用率高,思浦小区,250,http://sh.lianjia.com/ershoufang/sh4194652.html
梅林小区，温馨一室，配套完善，满5唯一减税,梅林小区,190,http://sh.lianjia.com/ershoufang/sh4216276.html
宜川一村，一室小户型，低区出入方便，装修精致,宜川一村,175,http://sh.lianjia.com/ershoufang/sh4210187.html
上门实勘，吉宅出售，满五年唯一，高区采光好,金杨七街坊,240,http://sh.lianjia.com/ershoufang/sh4195560.html
采光无敌好，如您所见，交通便利，正规成熟小区,真如西村,195,http://sh.lianjia.com/ershoufang/sh4201435.html
德州七村，1室1厅，来电即看，房型正气,德州七村,215,http://sh.lianjia.com/ershoufang/sh4213267.html
交通便利，满五年唯一，正规成熟小区，上门实拍,宜川一村,160,http://sh.lianjia.com/ershoufang/sh4184776.html
翔殷四村，1室1厅1卫，配套完善，闹中取静,翔殷四村,250,http://sh.lianjia.com/ershoufang/sh4186007.html
满五年唯一，1室0厅，配套完善，闹中取静,曹杨五村,205,http://sh.lianjia.com/ershoufang/sh4186100.html
上门实勘，省装修费，采光这边独好，地铁直达,大连西路90号,185,http://sh.lianjia.com/ershoufang/sh4197181.html
金桥沪东新村，一房温馨舒适，成熟小区，紧邻地铁,沪东新村,200,http://sh.lianjia.com/ershoufang/sh4162164.html
百年求知名校，满五年唯一，朝南，3线地铁环绕,漕溪四村,250,http://sh.lianjia.com/ershoufang/sh4202148.html
南北通透，小区中心位置，交通便利，满五唯一。,九峰小区,250,http://sh.lianjia.com/ershoufang/sh4201008.html
浦江大楼，配套完善，黄金楼层，适合自住,浦江大楼,180,http://sh.lianjia.com/ershoufang/sh4155882.html
链家好房，抢手火热，景观房，满五年唯一,万康家园,238,http://sh.lianjia.com/ershoufang/sh4163791.html
错过不再有，1室1厅1卫，配套完善，南北户型,蔷薇五村,200,http://sh.lianjia.com/ershoufang/sh4172642.html
真实在售，火爆热销，配套完善，上门实勘,城市方园,210,http://sh.lianjia.com/ershoufang/sh4184513.html
一南一北的户型 厨房卫生间客厅都带有朝天井的窗子,蔷薇新村,213,http://sh.lianjia.com/ershoufang/sh4170189.html
满五唯一少税，房型正气，成熟社区，火热出售,富友嘉园（二期）,250,http://sh.lianjia.com/ershoufang/sh3889966.html
小区中心  素质住户  房东人很好  双南户型,潼港三村,212,http://sh.lianjia.com/ershoufang/sh4185491.html
育秀东区，采光好，高清实拍，配套完善,育秀东区,175,http://sh.lianjia.com/ershoufang/sh4196469.html
配套完善，品质装修，链家房源，简约二室,兴浦新村,250,http://sh.lianjia.com/ershoufang/sh4190021.html
塔城路800弄，舒适三室，观望后悔莫及，上门实勘,塔城路800弄,238,http://sh.lianjia.com/ershoufang/sh4214927.html
稀少一房，满五唯一，户型正气,瑞和新苑,230,http://sh.lianjia.com/ershoufang/sh4192989.html
安康新村，两室户，高区景观房，一链倾城,安康新村,220,http://sh.lianjia.com/ershoufang/sh4192138.html
配套完善，热销房源，满五唯一少税，错过不再有,长达佳苑,210,http://sh.lianjia.com/ershoufang/sh4186327.html
高清实拍，温馨一室，上下楼方便，精装修,江桥二村,180,http://sh.lianjia.com/ershoufang/sh4214480.html
高东新村，满5唯一减税，正规成熟小区，两室户,高东新村,215,http://sh.lianjia.com/ershoufang/sh4173242.html
高东新村双南两房精装周边配套齐全交通方便,高东新村,245,http://sh.lianjia.com/ershoufang/sh4168211.html
高兴花园，享受好房，成熟社区，实地看房,高兴花园,250,http://sh.lianjia.com/ershoufang/sh4204745.html
放心好房，诚意出售，高区阳光房，满二年,朱行新四村,223,http://sh.lianjia.com/ershoufang/sh4165661.html
交通方便，采光好，配套完善，2室0厅,广中扩大小区,230,http://sh.lianjia.com/ershoufang/sh1123650.html
罗阳三村，大一房，全明户型，带天井，诚心出售,罗阳三村,235,http://sh.lianjia.com/ershoufang/sh2699935.html
德怡苑精装一室户，紧邻苏州河沿岸。,德怡苑,235,http://sh.lianjia.com/ershoufang/sh4150391.html
阳光城MODO自由区，配套完善，地铁房，有爱有家,阳光城MODO自由区,190,http://sh.lianjia.com/ershoufang/sh1094638.html
桃浦五村山茶苑，生活很便利，看房末班车，2室1厅,桃浦五村山茶苑,235,http://sh.lianjia.com/ershoufang/sh1898685.html
省装修费，真实在售，成熟社区，热门带看,启航城,175,http://sh.lianjia.com/ershoufang/sh2461609.html
曹安景林苑，没装修过，高清实拍，南北通透,曹安景林苑,200,http://sh.lianjia.com/ershoufang/sh3874509.html
随时可看，热门房源，改善住房，远离雾霾带,贝港南区,170,http://sh.lianjia.com/ershoufang/sh3222996.html
随时可看，上下楼方便，上门实拍，吉宅出售,贝港南区,160,http://sh.lianjia.com/ershoufang/sh4183335.html
精品一室户，朝向南，满五唯一,双阳路507号,188,http://sh.lianjia.com/ershoufang/sh4154914.html
河滨小区 地铁口稀缺小户型 精装一室户,城南路374弄,190,http://sh.lianjia.com/ershoufang/sh4124167.html
2室2厅，高清实拍，真实在售，地铁房,旭辉U天地,200,http://sh.lianjia.com/ershoufang/sh4071623.html
吴家湾路101弄，品质装修，正规成熟小区，刚刚降价,吴家湾路101弄,215,http://sh.lianjia.com/ershoufang/sh4158456.html
成熟社区，1室1厅，享受好房，采光这边独好,潼港八村,240,http://sh.lianjia.com/ershoufang/sh4209376.html
业主新委托，高清实拍，低楼层，满五唯一少税,泗塘四村,195,http://sh.lianjia.com/ershoufang/sh4218247.html
通河二村，温馨一室，一链倾城，成熟社区,通河二村,190,http://sh.lianjia.com/ershoufang/sh4220131.html
降价出售，正规成熟小区，上门实勘，温馨之家,南泉苑,205,http://sh.lianjia.com/ershoufang/sh4199785.html
德州二村，正规成熟小区，没装修过，温馨一室,德州二村,190,http://sh.lianjia.com/ershoufang/sh2006402.html
上钢一村，满2年，上门实勘，视野很好,上钢一村,180,http://sh.lianjia.com/ershoufang/sh2121924.html
紧邻8号地铁，毗邻欧尚，满五唯一，上门实勤,长海二村,200,http://sh.lianjia.com/ershoufang/sh3881823.html
东安二小，中间楼层，稀缺户型。,东安二村,210,http://sh.lianjia.com/ershoufang/sh4059976.html
新领地，温馨之家，上门实勘，地铁直达,新领地,245,http://sh.lianjia.com/ershoufang/sh4148700.html
国和一村，1室1厅，满2年，链家房源,国和一村,245,http://sh.lianjia.com/ershoufang/sh4167232.html
满二减税，人气房源，景观房，2室1厅,绿海家园,240,http://sh.lianjia.com/ershoufang/sh4179403.html
杨浦区稀缺楼层，房东房子已经看好，急售,三门路510弄,210,http://sh.lianjia.com/ershoufang/sh4210506.html
凉城三村精品小户型，实用面积大，得房率高,凉城三村,165,http://sh.lianjia.com/ershoufang/sh4212275.html
青龙公寓，错过不再有，高清实拍，地铁房,青龙公寓,230,http://sh.lianjia.com/ershoufang/sh4180394.html
高区阳光房，房本满两年，精致户型，成熟社区,桃浦十村（白丽路701弄）,226,http://sh.lianjia.com/ershoufang/sh4157004.html
连波路228弄，地铁房，1室1厅，上门实拍,连波路228弄,235,http://sh.lianjia.com/ershoufang/sh4162526.html
成熟地段小区  使用面积大 出行方便,寿光路161弄,210,http://sh.lianjia.com/ershoufang/sh4180690.html
鹤沙航城东茗苑，房本满两年，好房好心情，高清实拍,鹤沙航城东茗苑,240,http://sh.lianjia.com/ershoufang/sh4173603.html
鹤北新村一街坊，黄金楼层！房型正气,鹤北新村,245,http://sh.lianjia.com/ershoufang/sh4164627.html
成熟地段小区  使用面积大 出行方便,寿光路161弄,210,http://sh.lianjia.com/ershoufang/sh4180690.html
精装小一房适合小夫妻过渡景观楼层周边配套成熟,富特五村,195,http://sh.lianjia.com/ershoufang/sh4181319.html
闹中取静，成熟社区，上门实拍，如您所见,石泉路97弄,244,http://sh.lianjia.com/ershoufang/sh4171617.html
恒大小区，满2年，成熟社区，拎包入住,恒大小区,230,http://sh.lianjia.com/ershoufang/sh1827544.html
金桥六号线地铁旁寿二小区精装小一房,寿光路161弄,175,http://sh.lianjia.com/ershoufang/sh4162965.html
空气清新，紧邻地铁，房本满两年，成熟社区,凌兆新村（上浦路69弄）,220,http://sh.lianjia.com/ershoufang/sh4187257.html
局门路405弄，低区出入方便，上门实勘，温馨一室,局门路405弄,200,http://sh.lianjia.com/ershoufang/sh4205282.html
上钢八九村，景观房，交通便利，省装修费,上钢八九村,205,http://sh.lianjia.com/ershoufang/sh4104480.html
如您所见，温馨一室，满两年，品味装修,桃浦七村雪松苑,160,http://sh.lianjia.com/ershoufang/sh4201444.html
寿光路161弄，上门实勘，生活很便利，温馨之家,寿光路161弄,240,http://sh.lianjia.com/ershoufang/sh4172846.html
密云路471弄，人气房源，正规成熟小区，上门实拍,密云路471弄,210,http://sh.lianjia.com/ershoufang/sh4210508.html
小区环境优雅，交通便利，精装修2年,民京路838弄,200,http://sh.lianjia.com/ershoufang/sh4203441.html
满两年，地铁沿线，有爱有家，高清实拍,红旗四街坊,250,http://sh.lianjia.com/ershoufang/sh4190671.html
世博滨江经典一房，紧邻昌里路商业街，地段好,昌里路167弄,220,http://sh.lianjia.com/ershoufang/sh4152434.html
低楼层，出行方便，人气房源，小户型,开鲁三村,200,http://sh.lianjia.com/ershoufang/sh4191772.html
精致户型，满五年唯一，低楼层，新鲜好房,报春一村,215,http://sh.lianjia.com/ershoufang/sh4229027.html
小户型，高区阳光房，热门带看，满两年,金杨新村五街坊,240,http://sh.lianjia.com/ershoufang/sh4188377.html
万顺水原墅（公寓），上门实拍，链家房源，满两年,万顺水原墅（公寓）,208,http://sh.lianjia.com/ershoufang/sh4208844.html
临沂七村 紧邻6号线 稀缺一室半 内饰日式风格,临沂七村,205,http://sh.lianjia.com/ershoufang/sh4195608.html
绿地秋霞坊（公寓），热门带看，生活很便利，装修精致,绿地秋霞坊（公寓）,220,http://sh.lianjia.com/ershoufang/sh4210907.html
满2年，1室0厅，热门带看，装修精致,国和二村,230,http://sh.lianjia.com/ershoufang/sh4209659.html
南北直通，正规成熟小区，高清实拍，满两年,鹤北新村,240,http://sh.lianjia.com/ershoufang/sh4193179.html
低楼层，出行方便，人气房源，小户型,开鲁三村,200,http://sh.lianjia.com/ershoufang/sh4191772.html
绿地秋霞坊（公寓），热门带看，生活很便利，装修精致,绿地秋霞坊（公寓）,220,http://sh.lianjia.com/ershoufang/sh4210907.html
热门带看，上门实勘，错过不再有，正规成熟小区,桃浦三村红棉苑,243,http://sh.lianjia.com/ershoufang/sh4195276.html
上钢八九村，景观房，交通便利，省装修费,上钢八九村,205,http://sh.lianjia.com/ershoufang/sh4104480.html
如您所见，温馨一室，满两年，品味装修,桃浦七村雪松苑,160,http://sh.lianjia.com/ershoufang/sh4201444.html
空气清新，成熟社区，上门实勘，热门带看,罗阳七村,230,http://sh.lianjia.com/ershoufang/sh2202326.html
南桥路231号，近地铁，带天井，68平2房。,南桥路231号,230,http://sh.lianjia.com/ershoufang/sh4219119.html
链家房源，适合自住，新上房源，上门实勘,长岭路60弄,250,http://sh.lianjia.com/ershoufang/sh4218181.html
边套全明 诚意出售 精装 拎包入住 临近地铁,宜川二村,210,http://sh.lianjia.com/ershoufang/sh4206312.html
毗邻地铁，满五省税费，真实在售，配套完善,富锦路1659弄,240,http://sh.lianjia.com/ershoufang/sh4219522.html
黎明花园大一房诚意出售。可改两房。,黎明花园,235,http://sh.lianjia.com/ershoufang/sh4219919.html
高清实拍，交通便利，满五唯一少税，刚刚降价,四平路幸福村,225,http://sh.lianjia.com/ershoufang/sh4193587.html
凤城三村，朝南精装一室户,凤城三村,165,http://sh.lianjia.com/ershoufang/sh4179054.html
世博小区 房地铁  拎包入住,工农三村,240,http://sh.lianjia.com/ershoufang/sh3742795.html
双辽新村，高清实拍，温馨之家，低楼层,双辽新村,180,http://sh.lianjia.com/ershoufang/sh4225974.html
延吉四村，满五年唯一，配套完善，小户型,延吉四村,212,http://sh.lianjia.com/ershoufang/sh4219949.html
稀缺房源，满五省税费，链家房源，上下楼方便,镇北小区,188,http://sh.lianjia.com/ershoufang/sh4221663.html
临沂三村，南北通，新鲜挂牌，装修精致,临沂三村,215,http://sh.lianjia.com/ershoufang/sh4221852.html
临沂三村，南北通，新鲜挂牌，装修精致,临沂三村,215,http://sh.lianjia.com/ershoufang/sh4221852.html
上门实勘，热门房源，配套完善，上下楼方便,金光小区,250,http://sh.lianjia.com/ershoufang/sh4217406.html
国和二村，热门带看，温馨之家，景观房,国和二村,230,http://sh.lianjia.com/ershoufang/sh4218969.html
热门带看，上门实勘，正规成熟小区，品质装修,航华一村,245,http://sh.lianjia.com/ershoufang/sh4215913.html
广灵二村朝北一门关，紧邻地铁站得房率高黄金楼层。,广灵二村,150,http://sh.lianjia.com/ershoufang/sh4184421.html
满2年，正规成熟小区，地铁房，小户型,菊泉新城（陆翔路678弄）,250,http://sh.lianjia.com/ershoufang/sh4205911.html
小区中心位置，精装一房，完美户型，诚心出售,上陇新村,205,http://sh.lianjia.com/ershoufang/sh4214509.html
品质小区，朝南一房精装修，业主诚意出售价格可谈！,南新三村,215,http://sh.lianjia.com/ershoufang/sh4158854.html
仙逸小区 经典一室户黄金楼层 双南户型,仙逸小区,205,http://sh.lianjia.com/ershoufang/sh4153937.html
洛川中路1100弄，一室半南北户型，看房方便,洛川中路1100弄,220,http://sh.lianjia.com/ershoufang/sh4191390.html
南北通，成熟社区，业主新委托，一链倾城,新中新村,160,http://sh.lianjia.com/ershoufang/sh4194752.html
精致小区，绿化率高，看房方便，诚意出售,芷江西路123弄,238,http://sh.lianjia.com/ershoufang/sh4206520.html
虹南小区，毗邻地铁，高清实拍，高区采光好,虹南小区,230,http://sh.lianjia.com/ershoufang/sh3285985.html
业主信赖，采光无敌好，满五年唯一，1室1厅,东建新村,220,http://sh.lianjia.com/ershoufang/sh1138720.html
光线充足，上门实拍，业主信赖，简约二室,康平小区,250,http://sh.lianjia.com/ershoufang/sh4166882.html
呼玛三村好房子在等着您 您还在犹豫吗,呼玛三村,170,http://sh.lianjia.com/ershoufang/sh4152630.html
金桥沪东新村，小两房温馨舒适，适合居家，配套齐全,沪东新村,250,http://sh.lianjia.com/ershoufang/sh1075769.html
两房，附带双天井，有钥匙随时方便看房，,上炼二村,210,http://sh.lianjia.com/ershoufang/sh2460672.html
高清实拍，温馨之家，近地铁，钥匙房,虹一小区,230,http://sh.lianjia.com/ershoufang/sh3874401.html
有钥匙立即看，低楼层，小户型，上门实拍,塘桥路223弄,245,http://sh.lianjia.com/ershoufang/sh4187688.html
小户型，实地看房，上门实勘，高区采光好,延西小区,225,http://sh.lianjia.com/ershoufang/sh4190370.html
内环一室户，不限购不限贷，地铁旁，总价低,斜土路556弄,185,http://sh.lianjia.com/ershoufang/sh4194875.html
虹桥小区，上门实拍，实地看房，错过不再有,虹桥小区,228,http://sh.lianjia.com/ershoufang/sh3785665.html
幸福新苑，看房方便，满五年唯一，正规成熟小区,幸福新苑,215,http://sh.lianjia.com/ershoufang/sh4215501.html
呼玛五村 朝南正气房型 简装配套齐全，地铁房,呼玛五村,180,http://sh.lianjia.com/ershoufang/sh2124555.html
2室1厅1卫，正规成熟小区，新上房源，满二年,杨泰一村,180,http://sh.lianjia.com/ershoufang/sh4219310.html
新出房源，紧邻地铁，上门实拍，光线充足,荡湾新村,158,http://sh.lianjia.com/ershoufang/sh4223927.html
满二年，紧邻地铁，上门实拍，闹中取静,慧华东苑,240,http://sh.lianjia.com/ershoufang/sh4224481.html
丰庄十二街坊，光线非常好，新鲜好房，上门实勘,丰庄十二街坊,220,http://sh.lianjia.com/ershoufang/sh4220675.html
桃浦七村雪松苑，空气清新，温馨一室，满两年,桃浦七村雪松苑,180,http://sh.lianjia.com/ershoufang/sh4224072.html
桃浦七村雪松苑，视野很好，满两年，配套完善,桃浦七村雪松苑,175,http://sh.lianjia.com/ershoufang/sh4225557.html
交通方便，高清实拍，新上房源，1室1厅,金鹤新城双佳翠庭,240,http://sh.lianjia.com/ershoufang/sh4221726.html
近地铁精装一房，婚房装修，拎包入住，周边交通便利,大华一村,230,http://sh.lianjia.com/ershoufang/sh4197907.html
毗邻松江新城地铁站大江苑房型正气景观两房诚心出售,大江苑,248,http://sh.lianjia.com/ershoufang/sh4223976.html
欣佳宝邸紧缺户型，抢手房源。,欣佳宝邸,250,http://sh.lianjia.com/ershoufang/sh4218236.html
青龙公寓，如您所见，配套完善，品质装修,青龙公寓,245,http://sh.lianjia.com/ershoufang/sh4177167.html
姚西小区+成熟小区+租金高,姚西小区,230,http://sh.lianjia.com/ershoufang/sh1077017.html
新村路285弄，看房末班车，满五税费低，一室小户型,新村路285弄,180,http://sh.lianjia.com/ershoufang/sh1142752.html
小区内总价实惠，朝南一房，有钥匙,长宁路1600弄,200,http://sh.lianjia.com/ershoufang/sh1151715.html
重磅！中环边+铂金地段+紧邻9号线漕河泾！,虹梅路2806弄,200,http://sh.lianjia.com/ershoufang/sh2008299.html
低总价，一门关，房东诚意出售，看房方便,日晖六村,160,http://sh.lianjia.com/ershoufang/sh2167875.html
采光无遮挡，满五税费低，配套完善，高清实拍,大华一村,245,http://sh.lianjia.com/ershoufang/sh2257767.html
滨江一线景观房，不限购不限贷,中福世福汇,230,http://sh.lianjia.com/ershoufang/sh2289767.html
有钥匙立即看，正规成熟小区，火爆热销，1室1厅1卫,上青佳园,200,http://sh.lianjia.com/ershoufang/sh2934793.html
成熟社区 看房方便 业主诚意出售,天山三村,180,http://sh.lianjia.com/ershoufang/sh2949797.html
临近地铁2号线 主卧朝南采光好精装。,安龙大楼,248,http://sh.lianjia.com/ershoufang/sh3245851.html
延吉六村，地下车库拔高，前面采光无遮挡,延吉六村,210,http://sh.lianjia.com/ershoufang/sh3734160.html
双轨交通！很稀奇的一房一厅小户型！不限购不限贷！,新世纪大厦,170,http://sh.lianjia.com/ershoufang/sh3800505.html
上门实勘，1室1厅1卫，满5税费少，高区景观房,蒙自路252弄,210,http://sh.lianjia.com/ershoufang/sh4160293.html
隐于新华路，黄金楼层，售后公房无税费,香花桥小区,245,http://sh.lianjia.com/ershoufang/sh4181354.html
小两房+交通方便+老人新婚燕尔均适宜+随时可看,水电路1013弄,240,http://sh.lianjia.com/ershoufang/sh4218510.html
鞍山四村，黄金楼层，安静小区，毗邻地铁,鞍山四村第一小区,226,http://sh.lianjia.com/ershoufang/sh4222050.html
经典酒店式公寓 不限购不限贷 房型正气 通煤气,独立时代,220,http://sh.lianjia.com/ershoufang/sh3721121.html
世纪时空大厦，温馨之家，交通方便，错过不再有,世纪时空大厦,230,http://sh.lianjia.com/ershoufang/sh1064040.html
康乐小区，黄金三楼，小区中心位置，房型正,康乐小区（徐汇）,250,http://sh.lianjia.com/ershoufang/sh4161351.html
总价低，边套全明，中心位置，诚意出售！,浦发绿城,245,http://sh.lianjia.com/ershoufang/sh2134788.html
低楼层，两室户，火热出售，观望后悔莫及,三兴苑,230,http://sh.lianjia.com/ershoufang/sh3845771.html
繁华商圈内 高清实拍 购买力高 闹中取静,瑞金二路410弄,250,http://sh.lianjia.com/ershoufang/sh1213003.html
宝林二村，上门实拍，满5税费少，抢手火热,宝林二村,178,http://sh.lianjia.com/ershoufang/sh2202604.html
MAX未来，采光无敌好，火爆热销，1室1厅,MAX未来,170,http://sh.lianjia.com/ershoufang/sh2734398.html
繁华商圈内 高清实拍 购买力高 闹中取静,瑞金二路410弄,250,http://sh.lianjia.com/ershoufang/sh1213003.html
延北小区，一室小户型，毗邻地铁，上门实勘,延北小区,243,http://sh.lianjia.com/ershoufang/sh1143186.html
浦明师范，得房率高。采光充足。,潍坊五村,250,http://sh.lianjia.com/ershoufang/sh4158072.html
新鲜挂牌，放心好房，拎包入住，温馨之家,石一小区,250,http://sh.lianjia.com/ershoufang/sh4218549.html
民星路600弄，视野开阔，新鲜上架，满五年唯一,民星路600弄,200,http://sh.lianjia.com/ershoufang/sh4218220.html
丰庄四村，正规成熟小区，错过不再有，实地看房,丰庄四村,235,http://sh.lianjia.com/ershoufang/sh3282318.html
小户型，热门带看，吉宅出售，省装修费,李园一村,160,http://sh.lianjia.com/ershoufang/sh4192046.html
梅一稀缺小户型，满五年唯一，精装修拎包入住,梅川一街坊,250,http://sh.lianjia.com/ershoufang/sh4149509.html
配套完善，无装修，实地看房，上门实勘,鑫唐绿波庭,158,http://sh.lianjia.com/ershoufang/sh4220826.html
正规成熟小区，看房方便，视野开阔，高清实拍,栖山路1861弄,220,http://sh.lianjia.com/ershoufang/sh3216633.html
朱家门稀缺户型，房东装修花了很多心思。。,朱家门小区,245,http://sh.lianjia.com/ershoufang/sh4220786.html
高层小区，有钥匙，精装修，人气房源,高层小区,155,http://sh.lianjia.com/ershoufang/sh4190126.html
周康四村，省装修费，正规成熟小区，满五唯一少税,周康四村,248,http://sh.lianjia.com/ershoufang/sh4194140.html
成熟社区，有爱有家，采光无遮挡，上门实拍,莲溪二村,225,http://sh.lianjia.com/ershoufang/sh3676552.html
